,Titular,Cuerpo,Fecha_Publicada,N_Parrafos
7,El cambio climático dispara el número de muertes por el humo generado por los incendios,Redacción ciencia  oct (EFE) El cambio climático influye cada vez más en el comportamiento de los incendios en todo el mundo e intensifica su humo esto empeora la contaminación atmosférica y afecta a la salud pública en las ciudades cada año mueren más de  personas por el humo de los incendios Así lo advierten sendos estudios publicados este lunes en Nature Climate Change y liderados por el Instituto de Potsdam para la Investigación del Impacto Climático PIK El primer estudio constata que entre  y  la superficie quemada en todo el mundo debido al cambio climático ha aumentado el % especialmente en Australia Sudamérica el oeste de Norteamérica y Siberia Este incremento de los incendios forestales ha neutralizado la disminución de la superficie quemada debida a los cambios en el uso del suelo y al aumento de la densidad de población de los últimos años revela el estudio Partiendo de esta base el segundo estudio examina cómo el cambio climático está vinculado a un aumento global de las muertes por contaminación atmosférica relacionada con los incendios y revela que el cambio climático aumentó estas muertes de  anuales en la década de  a más de  en la de  “Nuestro estudio demuestra que cuando se producen incendios la influencia del cambio climático con condiciones meteorológicas más secas y cálidas es cada vez más significativa” explica Chantelle Burton investigadora del Met Office Hadley Centre y coautora principal del primer estudio A partir de un conjunto exhaustivo de modelos mundiales de incendios y vegetación muestran que el cambio climático ha aumentado la superficie quemada en todo el mundo en un % entre  y  en comparación con una situación sin cambio climático y con especial virulencia en Australia Sudamérica el oeste de Norteamérica y Siberia las regiones más propensas a los incendios Al mismo tiempo la superficie quemada en todo el mundo está disminuyendo a medida que las tierras naturales se convierten para usos humanos como la agricultura lo que ha reducido las áreas disponibles para los incendios en aproximadamente un % durante el mismo período Sin embargo aunque estas tendencias se contrarrestan mutuamente los investigadores consideran que el efecto del cambio climático sobre los incendios aumenta con el tiempo a medida que el clima sigue calentándose Un riesgo para la salud de la población El segundo estudio evalúa el impacto global del cambio climático en la contaminación atmosférica provocada por los incendios y los riesgos para la salud asociados en los últimos  años En concreto revela que las muertes debidas a la contaminación atmosférica causada por los incendios han pasado de  anuales en la década de  a  en la de  y según sus cálculos  muertes anuales de la década de  y más de  de  pueden atribuirse al cambio climático “Esto muestra que el cambio climático supone cada vez más una amenaza para la salud pública por culpa de un mayor humo de incendios que afecta incluso a zonas densamente pobladas” apunta Chae Yeon Park del Instituto Nacional de Ciencia y Tecnología Industrial Avanzada de Japón y autor principal El humo de los incendios contiene partículas extremadamente pequeñas que penetran en el sistema respiratorio y suponen un importante riesgo para la salud al causar enfermedades pulmonares y respiratorias Regiones como Sudamérica Australia y Europa experimentaron los aumentos más significativos de mortalidad por incendios atribuidos al cambio climático coincidiendo con las condiciones más cálidas y secas causadas por el calentamiento global Aunque la disminución de la humedad y el aumento de las temperaturas incrementan el riesgo de incendios los investigadores también observaron que en algunas zonas como el sur de Asia el aumento de la humedad provocó menos muertes por incendios atribuibles al cambio climático “Es crucial comprender que el impacto del humo de los incendios va más allá de quienes viven directamente en las zonas afectadas” porque “nuestro estudio confirma que la exposición al humo puede acarrear graves consecuencias para la salud pública” avisa Christopher Reyer coautor del estudio,21 de octubre de 2024 17:00 h,17
8,Canarias activa el céntimo forestal para crear un fondo específico de lucha contra el cambio climático,El Gobierno de Canarias activará en su presupuesto de  el céntimo forestal una medida que dotará a los cabildos de “músculo económico” para afrontar los retos del cambio climático mediante recursos dirigidos en su integridad a este objetivo Así lo ha anunciado este martes el presidente Fernando Clavijo en el Parlamento tras subrayar que los expertos consideran “vital y urgente” la creación de un fondo financiero “eficaz y estable” para atajar las amenazas sobre el ecosistema canario informs el Ejecutivo regional en nota de prensa Clavijo también ha recordado la advertencia lanzada por el Consejo Económico y Social (CES) tras alertar de que Canarias invierte menos de un céntimo de euro por cada metro cuadrado de espacio protegido El Gobierno trata de revertir esta escasez de recursos con la creación de un fondo financiero específico dirigido a actuar ante el creciente riesgo de incendios forestales y el avance de la desertificación No obstante el presidente ha adelantado en sede parlamentaria que la decisión final de aplicar este nuevo céntimo forestal quedará en manos de cada corporación insular También se ha referido al carácter finalista de los recursos que se recauden siendo obligatorio que se destine en su integridad a actuaciones centradas en la lucha contra el cambio climático El Ejecutivo autonómico lo garantizará vía reglamento El nuevo céntimo forestal permitirá a los cabildos aplicar un recargo de hasta  euros por litro en la exacción fiscal sobre los combustibles de automoción que ya existe en la comunidad autónoma Se calcula que gracias a esta medida y en el caso de que todas las corporaciones insulares decidan utilizarla se recaudarán en torno a  millones de euros anuales para luchar contra los efectos del cambio climático en el archipiélago El presidente ha destacado sin embargo que los profesionales del sector del transporte quedarán exentos de abonar este recargo sobre el impuesto de combustibles un tratamiento excepcional que será recogido en la disposición transitoria de la Ley de Presupuestos de  mediante la que se pondrá en marcha el céntimo forestal Propuesta científica La creación del céntimo forestal en las cuentas del próximo año surge de una propuesta diseñada y elevada al Gobierno por un panel de  expertos de toda Canarias En concreto ha sido elaborada por el equipo multidisciplinar conformado en una de las mesas de pilotaje creada por el Consejo de la Agenda Canaria  la denominada ‘Paisajes forestales resilientes y seguros’ En este sentido Fernando Clavijo ha destacado durante su intervención en la Cámara regional que el céntimo forestal surge de la apuesta del Gobierno autonómico por “escuchar a los científicos” y actuar “de su mano” para avanzar hacia la sostenibilidad del archipiélago Este compromiso del Ejecutivo por “buscar entre todos” soluciones para la Canarias “de las próximas décadas” ha recordado el jefe del Gobierno de Canarias se afianza aún más con el trabajo desarrollado por los cinco grupos de trabajo creados por la Comisión de Presidentes Al respecto Clavijo ha recodado que las conclusiones y  propuestas de estos equipos del Reto Demográfico fueron presentadas el pasado viernes y en la actualidad se encuentran en exposición pública para que puedan ser enriquecidas por organizaciones y ciudadanía en general Durante su comparecencia en el pleno del Parlamento el presidente ha subrayado que en este profundo debate sobre cómo avanzar hacia un modelo de desarrollo sostenible han participado más de  expertos de Canarias y de las comunidades autónomas de Aragón y el País Vasco Fruto de este trabajo se encuentra en exposición pública un “ambicioso” paquete de propuestas que abarcan todos los desafíos marcados por la Conferencia de Presidentes celebrada el  de abril el reto demográfico la fiscalidad y empleo en el sector turístico la transparencia en la protección y el desarrollo del territorio el acceso a la vivienda y la protección del medio ambiente Riesgos y amenazas En esta línea de trabajo la creación del céntimo forestal anunciada este martes por Clavijo es “un primer paso de los muchos que queremos dar hacia la sostenibilidad Su creación se sustenta en un informe científico que concluye que los recursos destinados en la actualidad en Canarias a la lucha contra el cambio climático ”son claramente escasos y fluctuantes“ En concreto los expertos alertan sobre “el elevado riesgo de incendios que actualmente existe unido a su incremento progresivo por el cambio climático y la pérdida de actividad primaria en las zonas de medianías de las islas occidentales urge al desarrollo de medidas preventivas contundentes que reviertan esta tendencia” Además consideran necesario actuar ante “el elevadísimo riesgo de desertificación que afecta a todo el archipiélago” tanto en algunas zonas de las islas occidentales como la totalidad de las islas orientales A la vista de estos riesgos y amenazas el grupo de pilotaje de la Agenda  aconseja al Gobierno implantar un mecanismo fiscal “relevante finalista y directamente vinculado a las administraciones competentes en la materia que permita la creación de un fondo financiero” con el que los cabildos puedan trabajar con constancia y recursos suficientes ante los efectos del cambio climático La propuesta diseñada por este panel de  expertos resalta la importancia de que los ingresos del céntimo forestal tengan un carácter finalista “claramente vinculado a la protección del medio ambiente mediante el secuestro de carbono” para “asegurar una clara relación entre los perjuicios derivados del hecho imponible (la combustión de hidrocarburos y la consecuente generación de emisiones de efecto invernadero) y el destino del impuesto”,Actualizado el 22/10/2024 17:12 h,17
9,“No es un problema lejano de osos polares y glaciares” la importancia de la universidad en la lucha contra el cambio climático,La Consejería de Desarrollo Sostenible y la Universidad de CastillaLa Mancha (UCLM) a través del Aula de Educación Ambiental en la que colaboran celebra este martes en el campus toledano el ‘Encuentro UCLM contra el Cambio Climático’ en el que participan más de  alumnos y alumnas de todos los campus de la región Como ha explicado la directora general de Economía Circular y Agenda  Esther Haro con motivo del Día Internacional contra el Cambio Climático que tiene lugar el próximo jueves  de octubre se ha organizado una jornada de divulgación y participación para el encuentro de jóvenes de los distintos campus universitarios de la UCLM El objetivo es “para mostrar que la comunidad universitaria es parte importante en la búsqueda de soluciones en la lucha contra el cambio climático” “Es importante reflexionar sobre esta realidad que afecta a todos los niveles de la sociedad como sabemos no es un problema lejano de osos polares y glaciares Es el futuro y también el presente del medio ambiente y está afectando ya a la calidad de vida la justicia social y la estabilidad económica” ha señalado Haro Y por ello se organizan este tipo de actividades “para generar acciones que sirvan para contrarrestar el cambio climático En este contexto ha animado al alumnado “a tomar partido y desde la Universidad contribuir a transformar nuestro entorno ya sea a través de la investigación el activismo o el simple hecho de educar a otros sobre la importancia de actuar dando ese paso al frente con compromiso” Acompañada por la vicedecana de la Facultad de Ciencias Ambientales y Bioquímica Ana María Rodríguez y la codirectora del Aula de Educación Ambiental de la UCLM Beatriz Pérez la directora general se ha referido a que “la Universidad deber de ser parte de la solución a la hora de innovar y proponer soluciones repensar la forma en que consumimos producimos y nos relacionamos con el medio ambiente” En este sentido Haro ha avanzado que la próxima semana se va a firmar el convenio de colaboración entre la Consejería de Desarrollo Sostenible y el Rectorado de la UCLM para la creación de la nueva ‘Cátedra de cambio climático y sostenibilidad del sector primario’ “Esta cátedra se crea con el objeto de incidir en el conocimiento difusión y desarrollo de buenas prácticas agroforestales que permitan una óptima compatibilidad de la producción primaria con el mantenimiento de los valores medioambientales” ha apuntado Así ha añadido que “estamos en la obligación con nuestras generaciones futuras de preservar un entorno saludable y en la medida de las posibilidades ser más sostenibles en nuestras acciones utilizar el transporte público consumir de forma responsable reciclar todos nuestros residuos apoyar el comercio local o comprar equipos electrodomésticos de bajo consumo” Por otro lado y dentro del compromiso y acciones que favorecen la lucha y la mitigación del cambio climático Esther Haro ha avanzado que el próximo  de noviembre de  en el Museo Paleontológico de CastillaLa Mancha en la ciudad de Cuenca se celebra la jornada titulada ‘Jornada de Turismo Circular de CastillaLa Mancha’ El objetivo como ha indicado la directora general “es dar a conocer el resultado del estudio que se está realizando sobre el establecimiento de criterios de circularidad específicos del sector turístico de la región la elaboración de indicadores de autoevaluación en materia de economía circular así como la elaboración de una guía de buenas prácticas para los negocios del sector” Todo ello considerando el marco de la Estrategia regional de Economía Circular  y el Plan de Acción para  ha finalizado,22 de octubre de 2024 12:55 h,9
10,Ojo con Pensilvania el estado que puede decidir las elecciones y alargar la agonía de cuándo lo sabremos,A la  de la madrugada del miércoles  de noviembre de  en Nueva York en el centro de convenciones de Nueva York bajo el techo de cristal donde Hillary Clinton planeaba celebrar su victoria la alerta más importante de la agencia Associated Press (AP) llegó a los móviles “Donald Trump gana Pensilvania” Con ese mensaje quedaba claro que el republicano sería el próximo presidente Habían pasado sólo unas pocas horas desde el cierre de las urnas aquel martes En noviembre de  la alerta de AP del nuevamente clave estado de Pensilvania llegó cuatro días después de las elecciones A las  de la mañana de la Costa Este del sábado  de noviembre la agencia anunció que Joe Biden había ganado Pensilvania en los comicios del martes y un minuto después que había ganado la presidencia de Estados Unidos ¿Qué había pasado en cuatro años para que el resultado Pensilvania tardara tanto en estar claro La votación en Pensilvania estaba ajustada en ambas elecciones presidenciales incluso más en  cuando Trump ganó a Hillary Clinton por  votos o siete décimas En  el margen de la victoria de Biden fue de unos  votos o el % de los votos Lo que había pasado entre esas dos elecciones presidenciales fue la aprobación en  en Pensilvania de la Ley  para reformar el sistema de votación del estado que como el resto tiene plenas competencias para decidir las reglas sobre el voto y el escrutinio La ley fue un acuerdo bipartidista entre la asamblea legislativa de Pensilvania controlada entonces por los republicanos y el gobernador demócrata Incluía una pieza clave la posibilidad de votar por correo para todos los ciudadanos sin tener que presentar justificación Así el voto por correo pasó del % en noviembre de  al % en noviembre de  en plena pandemia y cuando todavía no había vacuna para protegerse del COVID En Estados Unidos  estados permiten el voto por correo sin tener que presentar excusa pero la particularidad de Pensilvania es que no permite procesar los votos recibidos hasta las siete de la mañana del día de las elecciones cuando abren las urnas Los empleados electorales ponen un sello de “recibido” al voto por correo pero a diferencia de la mayoría de los estados en el país en Pensilvania no hacen nada más para preparar la papeleta que va metida en dos sobres y requiere varias comprobaciones antes de meterla en el lector óptico que cuenta los votos el día de las elecciones “Este es el principal motivo de los retrasos significativos en el recuento de votos en el estado” explica a elDiarioes Dan Mallison profesor de políticas públicas de la Universidad estatal de Pensilvania y especialista en política local “No creo que sepamos el ganador en Pensilvania la noche electoral porque la ley no permite a los trabajadores electorales hacer nada hasta las siete de la mañana de ese día” Mallison estima por los números hasta ahora que más de un millón de personas votarán por correo en Pensilvania y que el escrutinio puede ser especialmente lentos en condados muy poblados como el de Filadelfia En  votaron por correo en Pensilvania más de  millones de las casi siete millones de personas que participaron Entonces el índice de participación fue alto del % pero esta vez podría ser mayor Lo que tienen que hacer los empleados electorales antes de abrir esos votos para contarlos es verificar la firma y la fecha escrita del día en el sobre exterior que el votante está obligado a poner sacar la papeleta de ese sobre exterior y de otro sobre interior denominado “secreto” alisar la papeleta y meterla en el escáner que cuenta los votos “Las papeletas vienen a menudo dobladas varias veces y hay que quitarles las arrugas para que entren el escáner” explica a elDiarioes Steve Ulrich director del PoliticsPA un medio local especializado en la política de Pensilvania y que antes trabajó como director electoral de un condado “Si alguien cree que se va a quedar toda la noche despierto pensando que el escrutinio de Pensilvania se va a completar y va a estar listo para añadirlo al puzzle está muy equivocado” Ulrich recuerda la noche electoral de  en la oficina electoral que él dirigía en el condado de York uno de los  de Pensilvania y donde viven unas  personas En el caso del voto por correo unas  personas se encargaban de abrir el sobre exterior dejarlo a un lado y sacar la papeleta del sobre secreto seguro “Si no está dentro del sobre secreto lo dejas a un lado y lo marcas como problema… Y luego te encuentras papeletas dobladas en todo tipo de pliegues Hay papeletas como un acordeón… Vimos casos de votantes que las doblaron  veces” Cuenta que en York terminaron sus tabulaciones de votos alrededor de las dos de la mañana y todavía les quedaban  votos “provisionales” es decir los que se han emitido para luego ser revisados con más calma porque el nombre del votante no aparece en un colegio electoral hay alguna discrepancia o dificultad para identificarlo como votante registrado en un país donde no existe un documento nacional de identidad No lo puede hacer cualquiera porque es una revisión delicada y que puede acabar en los tribunales Los encargados de la revisión son habitualmente solo los miembros de la comisión electoral permanente del condado no los trabajadores electorales contratados para el día de las elecciones Los votos para la revisión se suelen dejar para el final “Un equipo de cuatro personas incluyéndome a mí tuvimos que analizar  papeletas provisionales” cuenta Ulrich “Si revisas una por minuto con un equipo de cuatro personas y sin ningún tipo de descanso serían unas  papeletas provisionales en una jornada de ocho horas… Para el total tardas cuatro días” Algunos condados avisan a los votantes por correo de los problemas para que tengan la oportunidad de arreglarlos con un voto provisional el día de las elecciones y la bola de papeletas va creciendo En  los condados de Pensilvania rechazaron unas  papeletas por defectos de forma y otros problemas Un error habitual recuerda Ulrich es que el votante pone en el sobre exterior su fecha de nacimiento en lugar de la fecha en la que ha mandado la papeleta Una nueva regla incluye ahora el año completo en el sobre para que el votante lo entienda mejor pero el Tribunal Supremo anuló en septiembre la sentencia de una corte inferior que dictó que era inconstitucional anular el voto por este defecto menor de forma cuando la papeleta dentro solo puede ser de este año y hay un sello que indica la recepción en la oficina electoral Cada obstáculo para votar o contar supone un retraso que puede acabar como en  Ulrich cree que aunque haya menos porcentaje de voto por correo en unas elecciones más normales sin pandemia el número puede seguir siendo elevado por la participación total Predice que puede llegar al % por “la atención que rodea a estas elecciones” “Todos escuchamos los desafíos que vamos a encontrar Pero si el estado o los condados no incorporan más personas está bastante claro lo que va a suceder” explica El intento de aprobar una ley bipartidista antes de las elecciones que permitiera empezar el proceso para al menos verificar las firmas del voto por correo y sacarlo del sobre exterior siete días antes del día de las elecciones ha fracasado Los republicanos querían incluir otras medidas como prohibir los buzones especiales para que los votantes depositen su papeleta de manera más segura en lugar de mandarla por correo La Cámara de Representantes de Pensilvania de mayoría demócrata aprobó el cambio para poder procesar los votos siete días antes del  de noviembre pero el Senado de mayoría republicana ni siquiera quiso someter la regla a votación Trump presionó a sus aliados locales para que pararan la ley según dijo una fuente a la revista Rolling Stone No se trata solo de la incomodidad o la tensión de esperar el resultado del estado clave por lo ajustada de la carrera y el número de votos electorales (reparte  de los  del colegio electoral necesarios para ser elegido presidente) El retraso en el escrutinio crea el llamado “espejismo republicano” ya que los republicanos que tienden a votar más en persona suelen ser los primeros en empezar a sumarse en zonas rurales y pequeñas mientras según se va añadiendo el voto por correo y el voto de las ciudades el escrutinio gira hacia los votantes demócratas Cuanto más lento sea el proceso más crecen las posibilidades de que Trump movilice a sus votantes para que “paren” el escrutinio como sucedió en  La brecha entre demócratas y republicanos en el uso del voto por correo además se ha agrandado desde que Trump y otros republicanos empezaron a difundir bulos de que no era seguro votar por correo o podría cometerse un fraude (más de  casos judiciales concluyeron en contra de las alegaciones Trump algunos porque la propia campaña retiró las denuncias) “Todas estas dinámicas son las mismas La legislatura de Pensilvania no ha solucionado ninguno de los problemas de no tener un procesamiento previo de las papeletas y la retórica del expresidente sigue siendo la misma” dice Mallinson el profesor de la Universidad de Pensilvania El voto por correo gusta en Pensilvania porque supone poder recibir las papeletas en casa y estudiarlas hay varias votaciones de cargos nacionales estatales y municipales y evita colas en un día laborable Hasta  republicanos y demócratas locales estaban de acuerdo en facilitarlo “No se convirtió en un problema hasta que el candidato presidencial que no ganó las elecciones decidió que era un problema” dice Ulrich el director de PoliticsPA Además del ritmo del escrutinio según las encuestas las elecciones están lo suficientemente ajustadas en Pensilvania hasta para provocar un recuento en este estado más allá de las revisiones estadísticas habituales o de las peticiones de las campañas Una diferencia de medio punto porcentual o menos provoca automáticamente un recuento en todo el estado es decir sufragado por el contribuyente y sin que sea necesaria una queja de un político o un votante Entonces ¿cuándo sabremos el resultado en Pensilvania y tal vez de las elecciones presidenciales “Estoy bastante seguro de que en Pensilvania harán falta un par de días más” contesta Ulrich “Todos los ojos estarán puestos sobre nosotros durante mucho tiempo Y vamos a tener que explicar por qué no podemos hacer esto más rápido”,23 de octubre de 2024 22:09 h,24
