,Titular,Cuerpo,Fecha_Publicada,N_Parrafos
0,Ministros americanos debaten en Bogotá desafíos laborales por IA y cambio climático,Bogotá  oct (EFE) Los países de la Organización de Estados Americanos (OEA) se reunieron este miércoles en Bogotá para debatir en la XXII Conferencia Interamericana de Ministros de Trabajo propuestas frente a los grandes retos del mundo laboral como la irrupción de la inteligencia artificial (IA) el cambio climático o problemas estructurales como la informalidad o la desigualdad Esta reunión es “resultado de un proceso en el que los países que integran la OEA hemos transitado para llegar a consensos y definir las estrategias para asegurar una recuperación sostenible y seguir construyendo un futuro de trabajo para las Américas” aseguró la anfitriona la ministra colombiana de Trabajo Gloria Inés Ramírez quien asumirá la presidencia de esta conferencia Se trata del principal foro en asuntos laborales para que los países de la región aborden estrategias conjuntas y construyan “la agenda regional en materia de trabajo” como definió el secretario adjunto de la OEA Néstor Méndez durante la inauguración “Es la oportunidad para lograr acuerdos y tener planteamientos regionales para responder a los desafíos globales” recordó Ramírez quien enunció algunos retos como la globalización el impacto de las tecnologías los cambios demográficos las guerras o la crisis climática que han afectado y profundizado las brechas en desigualdad Problemas estructurales Un mercado laboral donde uno de cada dos empleos son informales más de  millones de personas no reciben ingresos suficientes para cubrir las necesidades básicas o un tercio de la región aún en la pobreza siguen siendo los principales problemas que marcan el contexto regional “No va a haber justicia social sin un compromiso pleno para abordar la desigualdad eliminar la discriminación y asegurarse que se avanza sin dejar a nadie atrás” apuntó el director general de la Organización Internacional del Trabajo (OIT) Gilbert F Houngbo Es la primera reunión física tras la pandemia después de la de  que se realizó de forma virtual y donde se adoptó la Declaración de Buenos Aires muy centrada en los efectos de la covid y en los compromisos para enfocar la recuperación del empleo y las empresas Una pandemia que según Méndez “profundizó los desafíos económicos y sociales” y “amplió las profundas brechas de desigualdad” llevando a las Américas al “lamentable récord” de ser la región más desigual del mundo Nuevos retos Sin embargo esta reunión se produce en “un momento de profunda transformación del mundo del trabajo a nivel global” en palabras del secretario adjunto de la OEA y a esos problemas estructurales se le suman nuevos desafíos “Las dinámicas laborales están cambiando impulsadas en transformaciones tecnológicas como la IA la transformación demográfica y la transición ambiental” recordó Méndez Y continúo “Estamos viendo como algunas ocupaciones desaparecen en manos de la automatización mientras se crean nuevos empleos producto de la innovación tecnológica” Las plataformas tecnológicas por ejemplo ya emplean al  % de la fuerza laboral y en algunos países llega incluso al  % La descarbonización por otro lado puede llegar a producir un incremento neto de  millones de empleos en toda América Latina con iniciativas como el crecimiento verde Por eso durante este miércoles y el jueves los ministros y representantes de los Estados miembros a los que se unirán sindicatos patronales y otros países como España representado por la ministra de Trabajo y vicepresidenta segunda Yolanda Díaz debatirán propuestas y tratarán de trazar estrategias para enfrentar estos retos Todo ello con vistas a adoptar una nueva declaración la de Bogotá que trace una nueva hoja de ruta para el futuro del trabajo y la transición justa en las Américas,23 de octubre de 2024 21:25 h,17
1,Los cabildos de Fuerteventura Lanzarote y La Gomera se oponen al céntimo forestal para luchar contra el cambio climático,Los presidentes de los cabildos de Fuerteventura y Lanzarote Lola García y Oswaldo Brito respectivamente han anunciado este miércoles que al igual que La Gomera no aplicarán el céntimo forestal que se idea para luchar contra el cambio climático en las islas por entender que supone un impacto negativo sobre la fiscalidad del combustible En un comunicado remitido por el Cabildo de Lanzarote Lola García se ha mostrado partidaria de impulsar medidas para afrontar los retos del cambio climático aún más en islas como las orientales donde sus efectos son más que visibles pero se deben buscar los fondos adecuados La idea anunciada por el Gobierno en el Parlamento canario va “en detrimento del consumidor final que como siempre ocurre es el máximo perjudicado” ha recalcado García quien ha asegurado que “en ningún caso se va a aplicar esta medida en Fuerteventura cuando precisamente lo que pedimos desde principios de año es que en las islas orientales se bonifique la adquisición de carburante y no encarecerlo” El presidente del Cabildo de Lanzarote Oswaldo Betancort ha fundamentado su oposición a aplicar la medida al no ir “en la línea de trabajo medioambiental que sigue la corporación insular que cuenta con fondos e iniciativas únicas en Canarias en materia medioambiental” Para Betancort el céntimo forestal propuesto por el Ejecutivo regional “no encaja en las necesidades que hoy tiene Lanzarote que ya cuenta con medidas efectivas y duraderas” Además “está destinado principalmente a paliar los posibles incendios que se puedan dar en las islas algo que no es prioritario en el caso de Lanzarote” ha señalado El presidente del Cabildo de La Gomera Casimiro Curbelo ha rechazado también este miércoles en un comunicado la posibilidad de aplicar en la isla el céntimo forestal por su impacto negativo sobre la fiscalidad del combustible y ha propuesto que se cobre por los servicios prestados en los espacios naturales protegidos La medida del céntimo forestal fue anunciada este martes por el presidente Fernando Clavijo en el Parlamento tras subrayar que los expertos consideran “vital y urgente” la creación de un fondo financiero “eficaz y estable” para atajar las amenazas sobre el ecosistema canario informó el Ejecutivo regional en nota de prensa El nuevo céntimo forestal permitirá a los cabildos aplicar un recargo de hasta  euros por litro en la exacción fiscal sobre los combustibles de automoción que ya existe en la comunidad autónoma Se calcula que gracias a esta medida y en el caso de que todas las corporaciones insulares decidan utilizarla se recaudarán en torno a  millones de euros anuales para luchar contra los efectos del cambio climático en el archipiélago No obstante el presidente regional adelantó en sede parlamentaria que la decisión final de aplicar este nuevo céntimo forestal quedará en manos de cada corporación insular También se ha referido al carácter finalista de los recursos que se recauden siendo obligatorio que se destine en su integridad a actuaciones centradas en la lucha contra el cambio climático El Ejecutivo autonómico lo garantizará vía reglamento,23 de octubre de 2024 19:12 h,10
2,Una investigación destaca la importancia de las algas coralinas para combatir el cambio climático,Las Palmas de Gran Canaria  oct (EFE) Una investigación internacional en la que ha participado el Instituto ECOAQUA de la Universidad de Las Palmas de Gran Canaria destaca el papel crucial que desempeñan los bancos de algas coralinas en el ciclo del carbono oceánico informa la universidad Conocidos en Canarias como confites por el color blanco que adquieren cuando finalizan su periodo de vida y son arrastrados a la costa este estudio aporta nuevas evidencias sobre la capacidad de estos hábitats para luchar contra el cambio climático al ser una herramienta muy eficaz para combatir el exceso de carbono en el planeta fruto de la quema de combustibles fósiles Los resultados publicados recientemente en Nature Communications revista de referencia internacional sobre grandes avances científicos muestran que estos hábitats marinos distribuidos por todo el mundo y construidos por rodolitos con un llamativo color rosa a nivel submarino son capaces de absorber grandes cantidades de carbono atmosférico y acumular carbonato cálcico lo que los convierte en un importante sumidero de carbono clave para el futuro del planeta La publicación revela que los lechos submarinos de algas coralinas que cubren amplias áreas de la plataforma costera del planeta y que en Las Palmas de Gran Canaria dan lugar a topónimos como El Confital pueden absorber hasta  gramos de carbono por metro cuadrado al día superando a otros ecosistemas marinos formados por macroalgas como las laminarias o las pardas Estos hábitats son de color mayormente rojizorosado tonalidad típica de los rodolitos lo que les atribuye una identidad cromática muy particular La investigación titulada ‘El Poder Rosa La Importancia de los Bancos de Algas Rojas Coralináceas en el Ciclo del Carbono Oceánico’ (‘Pink Power The Importance of Coralline Algal Beds in the Oceanic Carbon Cycle’) fue dirigida por un equipo internacional de científicos de distintas universidades y centros liderados por la doctora Nadine Schubert de la Universidad del Algarve (Portugal) y en ella han participado los investigadores Fernando Tuya Francisco OteroFerrer y Fernando Espino del Grupo de Biodiversidad y Conservación (BIOCON) del Instituto ECOAQUA por parte de la Universidad de Las Palmas de Gran Canaria Los resultados del estudio que abarcó un amplio rango geográfico incluyendo tanto las aguas subtropicales como templadas del Atlántico subrayan que estos ecosistemas no solo contribuyen al ciclo del carbono mediante la fotosíntesis sino que además acumulan grandes cantidades de carbonato de calcio en sus estructuras lo que los convierte en depósitos estables de carbono a largo plazo Hasta ahora había poca información sobre su productividad ya que la dinámica de flujo neto de carbono y los depósitos de carbonato dificultan la evaluación de su contribución al ciclo global del carbono oceánico Con los datos obtenidos que abarcan amplios rangos batimétricos de  a  metros se demuestra que “los lechos de algas coralinas son hábitats altamente productivos con tasas sustanciales de absorción de carbono de entre  y  gramos por metro cuadrado al día” señala el investigador y coautor de este artículo Fernando Tuya Estas tasas que varían en función de la disponibilidad de luz y la composición de las especies superan las estimaciones reportadas para otros hábitats constituidos por macroalgas cuya gran importancia en el ciclo del carbono a nivel global estaba más documentada Sumidero del exceso de carbono “Esta alta productividad junto con sus considerables depósitos de carbonato (– kilotoneladas) convierte los lechos de algas coralinas en contribuyentes altamente relevantes al ciclo del carbono oceánico actual y futuro jugando un papel muy importante como sumidero del exceso de carbono” destaca Tuya director del grupo BIOCON de ECOAQUA Estas características les otorgan un papel fundamental en la lucha contra el cambio climático por lo que su protección es vital para la conservación del medio marino de todo el planeta Tuya resalta la “imperiosa necesidad” de incorporar los bancos de rodolitos en programas de conservación del medio marino pues “son ecosistemas marinos altamente productivos y de gran relevancia para la absorción de carbono a nivel global” En palabras del investigador “estos resultados proporcionan argumentos sólidos para su inclusión en marcos nacionales o internacionales relevantes de conservación como la Red Natura  donde actualmente estos hábitats no están incluidos” Este hallazgo es especialmente relevante en un contexto de creciente acidificación oceánica puesto que aunque este fenómeno puede acelerar la disolución de los depósitos de carbonato también puede mejorar la capacidad de los bancos de algas coralinas para capturar dióxido de carbono Además del grupo BIOCON de ECOAQUA que ya había realizado con anterioridad iniciativas similares a las de este estudio aunque en ámbitos meramente locales como MACRODO esta investigación ha contado con la participación de un total de  universidades e instituciones científicas procedentes de España entre las que se encuentra la Asociación Biodiversidad Atlántica y Sostenibilidad (ABAS) en Telde (Gran Canaria) de Portugal de Italia de Francia de Irlanda de Brasil o de Australia,22 de octubre de 2024 21:05 h,17
3,Canarias gravará los combustibles con  céntimos para luchar contra el cambio climático,Santa Cruz de Tenerife  oct (EFE) Los siete cabildos insulares de Canarias podrán aplicar en  hasta dos céntimos de euro de recargo a los combustibles para automoción para dedicar esos recursos a actuaciones centradas en la lucha contra el cambio climático por ejemplo medidas contra los incendios forestales o contra la desertificación El Gobierno de Canarias ha informado de que este denominado “céntimo forestal” es un recargo sobre el impuesto de combustibles que se incluirá en el presupuesto de  y del que quedarán exentos los profesionales del sector del transporte Cada cabildo podrá decidir si aplica o no ese recargo hasta un máximo de  euros por litro de combustible y los ingresos tendrán carácter finalista es decir no se pueden emplear para otros fines Si todas las corporaciones insulares lo aplicaran la recaudación alcanzaría unos  millones de euros anuales según los cálculos del Gobierno de Canarias El céntimo forestal fue diseñado y propuesto por un equipo multidisciplinar de  expertos en una de las mesas creada por el Consejo de la Agenda Canaria  Los expertos han alertado de que los recursos destinados en Canarias a la lucha contra el cambio climático son “escasos y fluctuantes” Ante la proliferación de incendios y la pérdida de actividad primaria en las zonas de medianías de las islas occidentales urge al desarrollo de “medidas preventivas contundentes que reviertan esta tendencia” según los expertos Alertan también sobre “el elevadísimo riesgo de desertificación que afecta a todo el archipiélago” Aconsejan implantar un mecanismo fiscal “relevante finalista y directamente vinculado a las administraciones competentes en la materia que permita la creación de un fondo financiero con el que los cabildos puedan trabajar con constancia y recursos suficientes ante los efectos del cambio climático”,22 de octubre de 2024 17:29 h,9
4,Goia achaca al cambio climático que se vean más ratas en Donostia,El alcalde de Donostia Eneko Goia ha afirmado que el avistamiento de ratas en distintos puntos de la ciudad puede estar causado por el cambio climático que hace que “salgan más a la superficie” al tiempo que ha asegurado que es una cuestión en la que el Ayuntamiento “está absolutamente encima” En rueda de prensa tras la Junta de Gobierno municipal de este martes Goia preguntado por las denuncias de vecinos de varios barrios sobre la presencia de ratas ha señalado que el Ayuntamiento cuando recibe una queja o denuncia por la aparición de roedores suele “desratizar la zona sobre la que aparecen los avisos” según recoge Europa Press Según ha explicado ha hablado de este tema con el responsable del área y parece que hay “dos cosas que pueden estar teniendo una incidencia negativa y no solo en Donostia sino en general” En este sentido ha indicado que “una de las posibles consecuencias del cambio climático es ésta no el que haya más ratas sino que salgan más a superficie” de manera que son “más visibles” A ello ha añadido que “las ratas normalmente suelen desarrollar inmunidad a los venenos y por eso hay que ir cambiándolos permanentemente” “Puede que también haya algo de eso” ha señalado En todo caso ha asegurado que desde el Consistorio están “absolutamente encima para intentar controlar a esos roedores” y que continuarán “atendiendo a las llamadas” que se hagan al respecto elDiarioesEuskadi está en X en Facebook en Instagram en Telegram en WhatsApp y en Threads Cada semana te enviamos un boletín a tu correo electrónico ¡Apúntate Recuerda que puedes ser socio o socia de elDiarioes clicando aquí Y para más información puedes llamar o escribirnos al    ,22 de octubre de 2024 12:25 h,4
5,Canarias incluirá el céntimo forestal en los presupuestos de  para luchar contra el cambio climático,SANTA CRUZ DE TENERIFE  (EUROPA PRESS) El presidente del Gobierno de Canarias Fernando Clavijo ha anunciado este martes ante el Pleno del Parlamento que en los presupuestos autonómicos de  se incluirá el llamado céntimo forestal cuya recaudación se destinará a un fondo para luchar contra el cambio climático En una comparecencia para abordar el trabajo de las cinco mesas de expertos impulsadas por el Ejecutivo para abordar el futuro de las islas ha subrayado que cada cabildo tendrá en su mano decidir si quiere aplicarlo El presidente del Gobierno ha garantizado también que el sector profesional del transporte quedará exento de abonar este recargo sobre el impuesto del combustible La iniciativa ha sido elaborada por un panel de expertos que aconseja un fondo financiero “eficaz y estable” para atajar el riesgo de incendios forestales y la desertificación y Clavijo está convencido de que dotará de “músculo económico” a los cabildos Clavijo también ha recordado la advertencia lanzada por el Consejo Económico y Social (CES) tras alertar de que Canarias invierte menos de un céntimo de euro por cada metro cuadrado de espacio protegido y se ha referido al carácter finalista de los recursos que se recauden siendo obligatorio que se destine en su integridad a actuaciones centradas en la lucha contra el cambio climático El Ejecutivo autonómico lo garantizará vía reglamento remarca a través de una nota El nuevo céntimo forestal permitirá a los cabildos aplicar un recargo de hasta  euros por litro en la exacción fiscal sobre los combustibles de automoción que ya existe en Canarias Así se calcula que gracias a esta medida y en el caso de que todas las corporaciones insulares decidan utilizarla se recaudarán en torno a  millones de euros anuales para luchar contra los efectos del cambio climático en el archipiélago La creación del céntimo forestal en las cuentas del próximo año surge de una propuesta diseñada y elevada al Gobierno por un panel de  expertos de toda Canarias En concreto ha sido elaborada por el equipo multidisciplinar conformado en una de las mesas de pilotaje creada por el Consejo de la Agenda Canaria  la denominada Paisajes forestales resilientes y seguros,22 de octubre de 2024 17:27 h,11
6,ONU España uno de los más vulnerables al cambio climático por sus  kms de costa,lAlfàs del Pi (Alicante)  oct (EFE) Los más de  kilómetros de litoral que tiene España le convierten en uno de los países del mundo más vulnerables al fenómeno del cambio climático según la asesora especial para el Secretario General de ONU Turismo (UNWTO) Isabel Oliver Segreras Así lo ha afirmado este martes la también exsecretaria de Estado de Turismo en la apertura del II Congreso Internacional de Bandera Azul que entre hoy y el jueves reúne a decenas de expertos en playas y ecosistemas marinos sostenibles en lAlfàs del Pi (Alicante) y Gandía (Valencia) en un acto de inauguración con la participación de los respectivos alcaldes Vicente Arques y José Manuel Prieto Tras recordar que el mar y los océanos cubren el  por ciento del planeta y que son la base de sectores económicos tan potentes como el turismo la pesca y los transportes ha destacado su “fragilidad” ante los fenómenos de la contaminación y la sobreexplotación “El mar es belleza y fragilidad y al mismo tiempo los océanos tienen un papel muy importante para contrarrestar los efectos del cambio climático que a la vez sufren especialmente” ha explicado a los participantes de un congreso internacional que se celebra en un país “con una costa inmensa de  kilómetros donde viven millones de personas y que se ha convertido en un espacio especialmente sensible” El turismo de costa el  por ciento del mundial Ha abogado por tratar de “mantener un equilibrio entre el uso y el disfrute racional del litoral” y ha advertido de que esto es “esencial tanto para nosotros como para el planeta” en un mundo donde “el turismo costero representa el  por ciento del mundial” La Agenda  sitúa la lucha contra la contaminación de costas y mares entre los grandes retos actuales y ha advertido de que las acciones para la consecución de este objetivo “no pueden recaer sólo en los gobiernos sino entre los sectores público privado y organizaciones como ADEAC (organizadora del congreso de Bandera Azul)” También ha asegurado que la ONU está “firmemente comprometida” en un turismo sostenible y en la necesidad de aprovechar la capacidad del sector turístico para “transformar los destinos” y ha puesto como ejemplo los esfuerzos de la UNWTO en la lucha contra los plásticos (“el reciclaje es nuestra obsesión”) Un  por ciento de la superficie marina española estará protegida en  Por su parte la vicepresidenta adjunta de Organización del CSIC y científica en numerosas expediciones del estudio de los océanos María Gómez Ballesteros ha explicado que España es el segundo país europeo con mas espacio marino sólo por detrás de Portugal pero el primero con más área protegida Ha valorado además que en  el  por ciento de la superficie submarina estaba protegida una cifra que se sitúa actualmente en el  y que aumentará hasta el  según el compromiso adquirido por el Ministerio de Medio Ambiente un dato que ha destacado En su ponencia “El mar Imprescindible para la vida” Gómez Ballesteros ha alertado de la presencia de microplásticos “en todos los mares” del planeta y ha asegurado que “cerca de las ciudades hay auténticos vertederos marinos” que serían motivo de sonrojo y que contribuyen “a poner en peligro unos ecosistemas marinos muy frágiles” Ha calificado la investigación marina como “fundamental” para la “gobernanza de los océanos” y para adquirir el conocimiento necesario para la preservación de los mares un actor indispensable “para combatir la crisis climática” En este sentido ha recordado que el  por ciento de las emisiones de dióxido de carbono (CO) de los últimos siglos han sido asumidas por los fondos marinos a través de las algas arrecifes y demás sumideros naturales con lo cual “hay que mantener el equilibrio entre el océano y la atmósfera para mantener la vida del planeta”,22 de octubre de 2024 14:24 h,14
