,Titular,Cuerpo,Fecha_Publicada,N_Parrafos
17,Bolsonaro reitera su apoyo a Trump a dos semanas de las elecciones en Estados Unidos,São Paulo  oct (EFE) El expresidente ultraderechista brasileño Jair Bolsonaro () reiteró este martes su apoyo al exmandatario estadounidense Donald Trump en las elecciones presidenciales de Estados Unidos que se celebran dentro de dos semanas “Estamos animando a Trump Cuando salió (de la presidencia) mirad la desgracia en que se convirtió el mundo” declaró durante una rueda de prensa en la ciudad de São Paulo Bolsonaro recibió el apoyo del candidato republicano en las elecciones presidenciales de  que perdió ante Luiz Inácio Lula da Silva y ambos líderes han mantenido el contacto y la sintonía ideológica pese a haber dejado el poder Además el exmandatario aplaudió a la brasileña que durante un evento de campaña reciente de Trump en un restaurante de la cadena McDonald´s le pidió al candidato republicano que no dejara que “EEUU se convirtiera en un Brasil” Después de que el video se viralizara en redes sociales Bolsonaro dijo que había conversado por teléfono con la brasileña que es instructora de armas de fuego en Estados Unidos El exmandatario ultra aprovechó para criticar a Lula por supuestamente aliarse a dictaduras como China Rusia y Venezuela y por “golpear” a Israel país al que tachó de “nación amiga” y que el actual presidente ha atacado por la ofensiva israelí en Gaza Lula participa por videoconferencia esta semana en una reunión de los BRICS un grupo de países que incluye a China y Rusia y que está en plena expansión con la inclusión de naciones que viven bajo regímenes dictatoriales Por otra lado el presidente se ha distanciado del Gobierno venezolano de Nicolás Maduro cuya cuestionada victoria electoral no ha sido reconocida por el brasileño,22 de octubre de 2024 21:45 h,8
18,El candidato oficialista Delgado dice que en las elecciones de Uruguay es “avanzar o retroceder”,Montevideo  oct (EFE) El candidato oficialista a la presidencia de Uruguay Álvaro Delgado aseguró este martes que en las elecciones que el país suramericano afrontará el domingo  de octubre la población deberá decidir “entre avanzar o retroceder” Así lo afirmó el político durante su disertación en un almuerzo de trabajo organizado por la Asociación de Dirigentes de Marketing Delgado candidato por el Partido Nacional apuntó que en las elecciones presidenciales y parlamentarias del próximo domingo “se va a manifestar que la coalición de Gobierno es el proyecto político más votado de Uruguay” Al mismo tiempo destacó que el domingo por la noche al final de la jornada electoral se empezará a construir el próximo Gobierno uruguayo y que un día después los partidos de la coalición comenzarán a trabajar en un programa único que garantizará “rumbo certeza y confianza” “El domingo empezamos a confirmar la reelección de este rumbo” enfatizó Delgado quien hizo hincapié en la credibilidad que su fuerza política tiene no solamente por sus propuestas sino también por lo hecho en los cuatro años y medio que lleva gobernando Uruguay “Lo que hemos generado como Gobierno y como coalición en la gente es confianza Damos tranquilidad Con nosotros no hay sorpresas con nosotros hay oportunidades con nosotros hay desarrollo” apuntó Delgado Por otro lado el candidato oficialista apuntó que a diferencia de lo ocurrido en  no hay clima electoral y enfatizó que en aquella oportunidad había “un clima de cambio” Dijo que esto se debe en parte a que hay “un clima mayoritario de continuidad” y que este se verá reflejado en las urnas Finalmente quien fuera secretario de Presidencia entre  y  remarcó que conoce “el tablero de control” de la Torre Ejecutiva sabe dónde está la llave general para ingresar el  de marzo del próximo año y comenzar a gobernar Este martes por la noche Delgado cerrará su campaña con un acto en la ciudad de Las Piedras ubicada a unos  kilómetros de Montevideo El próximo domingo Uruguay afrontará unas elecciones en las que la ciudadanía elegirá al presidente y a los parlamentarios para el período  En caso de que ninguno de los aspirantes supere el  % de los votos el  de noviembre se llevará a cabo una segunda vuelta entre los dos más votados,22 de octubre de 2024 21:12 h,12
19,El Gobierno de Bolivia culpa a Evo Morales de tratar de frenar las elecciones judiciales,La Paz  oct (EFE) El Gobierno de Bolivia culpó este martes al expresidente Evo Morales () de tratar de frenar las elecciones judiciales previstas para el  de diciembre después de informar que diputados senadores y dirigentes afines al exmandatario presentaron en lo que va del año  recursos legales contra ese proceso electoral “Esta posición actual de abogados diputados senadores y dirigentes muestra que el que está orquestando todo para que no haya elecciones judiciales es el señor Evo Morales” afirmó el ministro de Justicia César Siles en una conferencia de prensa Afirmó que son  los recursos legales que presentaron los allegados a Morales “entre amparos acciones de cumplimiento de libertad populares y de inconstitucionalidad” que tienen que ser analizados por instancias de la justicia boliviana por lo que las elecciones judiciales están en vilo La Constitución Política del Estado (CPE) boliviana vigente desde  establece la elección por voto popular de los magistrados de los principales tribunales del país previamente seleccionados por el Legislativo para un mandato de seis años En las elecciones judiciales de  y  cuando Morales era presidente la mayoría de electores votó nulo y blanco en rechazo a los procesos al considerarlos manipulados por la mayoría legislativa del oficialista Movimiento Al Socialismo (MAS) En  la votación nula y blanca mayoritaria fue en respuesta a un fallo del Tribunal Constitucional Plurinacional (TCP) que habilitó la candidatura de Morales a las elecciones generales de  luego anuladas pese a que la Constitución y un referendo le impedían volver a postular Los sectores afines al expresidente anunciaron en la víspera que presentarán un amparo en contra de las elecciones judiciales por cuya realización efectuaron bloqueos de carreteras a principios del año al considerar que los pueblos indígenas no están debidamente representados en el proceso actual El ministro de Justicia dijo que Morales “le miente al pueblo boliviano” al decir en enero que los actuales magistrados tenían que ser cambiados y ahora al decir que las elecciones judiciales están “viciadas de nulidad” y no deberían llevarse a cabo Los seguidores de Morales cumplen esta jornada el noveno día de bloqueos de carreteras en defensa de Morales debido a una posible orden de captura en su contra por un caso de trata de personas y estupro relacionado con la presunta “violación” de una menor con la que habría tenido un hijo en  cuando era presidente También reclaman al Gobierno soluciones a la escasez de dólares y combustibles y al encarecimiento de algunos alimentos y además salen en defensa de su candidatura para las elecciones generales de  “El motivo ahora del bloqueo que asfixia al pueblo boliviano es que no haya elecciones judiciales que se mantengan los actuales magistrados () La única persona que no quiere que haya elecciones es Evo Morales nótese que busca un pretexto diferente para convulsionar el país” aseguró Siles El proceso para las elecciones judiciales previstas para el  de diciembre se ha realizado con tropiezos y paralizaciones hasta que finalmente en agosto pasado el Legislativo envió los listados de candidatos al órgano electoral,23 de octubre de 2024 00:55 h,12
20,Dellafuente cambia el Bernabéu por dos Metropolitanos para compensar el concierto cancelado por el Real Madrid,Nueva víctima musical por la paralización de los conciertos en el Santiago Bernabéu El músico Pablo Enoc más conocido como Dellafuente ha anunciado que su gran actuación en Madrid prevista para el  de noviembre en el estadio del Real Madrid se celebrará finalmente en el Metropolitano “Da igual dónde da igual cuándo lo importante es con quién” ha compartido en sus redes el exitoso artista granadino Una frase con la que anima a sus fans a asistir a dos conciertos (aprovecha el cambio para añadir una segunda fecha) que tendrán lugar los próximos  y  de junio ya en  La preventa para la segunda fecha se activará el jueves  de noviembre a partir de las  previa inscripción en este enlace En esa fecha las personas inscritas recibirán un mail con un link de compra y un código único que permitirá acceder a la venta de entradas en ese mismo momento “El aplazamiento de la fecha inicial se debe a causas completamente ajenas a la voluntad tanto de Dellafuente como de la organización” indica la promotora Maas en la nota de prensa La decisión de suspender los eventos musicales en el recinto la tomó el propio club presidido por Florentino Pérez después de las continuas quejas por rebasar los límites de ruido permitidos algo que quedó acreditado y ha supuesto multas del Ayuntamiento por más de  euros a las entidades promotoras de los conciertos celebrados A ello se han sumado después problemas derivados de la licencia con la que se celebraron los conciertos “Este movimiento atiende a una de las principales peticiones del público desde que se anunció el show una segunda noche Una nueva oportunidad para las casi  personas que intentaron conseguir entradas la última vez las cuales se agotaron en menos de una hora” explican desde la promotora Consideran el anuncio una muestra de “la capacidad de Dellafuente para reinventarse y superar desafíos” Los promotores aprovechan para alardear de las bondades del nuevo espacio escogido al que ya se refieren con su nuevo patrocinio Riyadh Air Metropolitano “Uno de los recintos de referencia nacional y europea acogerá como estaba previsto un espectáculo pionero en su planteamiento un show con diseño  y una dirección creativa innovadora la altura de una fecha tan especial” Una altura a la que en esta ocasión el Bernabéu no ha podido o no ha sabido estar Recibe las noticias más importantes de Madrid con un boletín escrito para ti todos los viernes en tu correo Apúntate aquí y recíbelas junto a los mejores planes para el fin de semana También puedes seguirnos desde tu red social preferida en Facebook TwitterX o Instagram,23 de octubre de 2024 17:01 h,8
21,Cambian las fronteras entre Madrid y Rivas a los límites que marca la M dentro del pacto por la Cañada Real,Las fronteras de Madrid se mueven Los ayuntamientos de la capital y de Rivas Vaciamadrid aprueban este jueves un cambio en sus términos municipales para adecuar sus límites a lo acordado en el Pacto Regional por la Cañada Real Galiana suscrito en  entre la Delegación del Gobierno en Madrid la Comunidad de Madrid y los citados municipios además del de Coslada El cambio implica que la carretera M marque los límites de ambos municipios y establezca una frontera física que hasta ahora no coincidía con la geográfica Rivas entrega a Madrid unos terrenos al norte de la A con una superficie de  m y la capital regional hace lo propio con otro terreno triangular al también al norte de la A de  m además de otras parcelas de  m al sur de esta autovía Por ambos lugares discurre la Cañada Real Después de su aprobación el expediente será sometido a información pública durante un mes Luego ambos ayuntamientos deberán responder a las alegaciones y aprobarlo en pleno por mayoría absoluta Y la alteración de los términos municipales será avalada previsiblemente por el Consejo de Gobierno de la Comunidad de Madrid Con el cambio aprobado también se modifica el reparto competencial sobre tres de los seis sectores de la Cañada Real Galiana de la siguiente manera Para facilitar a los residentes en la zona las gestiones por el cambio de municipio se constituirá un grupo de trabajo mixto entre los dos consistorios que recalcan en una nota conjunta “la buena sintonía con la que han venido trabajando ambos ayuntamientos especialmente sus equipos de urbanismo” La alcaldesa de Rivas Vaciamadrid Aída Castillejo (IU) celebra que el acuerdo pueda ayudar a “las familias de uno y otro lado de la M para que puedan vivir con dignidad” También anuncia que el terreno ganado para su localidad será dedicado a desplegar un parque natural y zonas verdes Los ayuntamientos de Madrid y de Rivas Vaciamadrid suscribieron el  de mayo de  el Pacto Regional por la Cañada Real junto con la Delegación del Gobierno de Madrid la Comunidad de Madrid y el Ayuntamiento de Coslada Ese acuerdo incluyó como anexo la propuesta de modificación de términos municipales En enero de  ambos consistorios suscribieron un protocolo que definía el intercambio de suelo en el ámbito de la Cañada Sectores   y  En marzo de  se inició el primer expediente para la solicitud a la Comunidad de Madrid de la alteración del término municipal Sin embargo durante la tramitación del expediente Rivas Vaciamadrid replanteó los términos iniciales de la propuesta para incorporar nuevos suelos de Madrid debido a que el consistorio ripense disponía de un suelo previsto para un nuevo cementerio que como consecuencia de la redelimitación inicial pasaría a quedar dentro del término municipal de Madrid Además de incluirlo en el término de Rivas este ayuntamiento requirió de un suelo adicional de Madrid para construir un nuevo acceso a la vía de servicio de la A Esta solicitud fue planteada por el anterior alcalde de Rivas Vaciamadrid mediante carta en noviembre de  Ese mismo mes Ayuntamiento de Madrid aceptó este planteamiento trasladando en el mes de diciembre una nueva propuesta geográfica elaborada la Dirección General de Planificación Estratégica El segundo expediente con la ampliación propuesta que ahora es elevado a la Comunidad de Madrid se inició formalmente en febrero de  Recibe las noticias más importantes de Madrid con un boletín escrito para ti todos los viernes en tu correo Apúntate aquí y recíbelas junto a los mejores planes para el fin de semana También puedes seguirnos desde tu red social preferida en Facebook TwitterX o Instagram,24 de octubre de 2024 00:00 h,10
22,La Federación baja a un partido el cierre parcial del Metropolitano por los incidentes del Atlético  Real Madrid,El Comité de Competición de la Real Federación Española de Fútbol (RFEF) ha reducido de tres partidos a uno el cierre parcial del fondo sur del Metropolitano después de que el organismo impusiera esta sanción por los incidentes acaecidos durante el Atlético  Real Madrid del pasado  de septiembre Originalmente el castigo ascendía a tres encuentros pero el recurso del club presidido por Enrique Cerezo ha disminuido la cantidad El conjunto colchonero argumentó en su reclamación que el castigo era “desproporcionado” un argumento que el Comité de la RFEF ha decidido estimar parcialmente según adelanta ABC Cuando la sanción sea efectiva este domingo contra el CD Leganés el cierre afectará a parte de la grada baja fondo sur los sectores del  al  Se trata de la ubicación desde la que se lanzaron objetos y se dirigieron insultos a la zona donde estaba el portero del Real Madrid Thibaut Courtois A la clausura parcial por un partido se suma una multa económica de  euros para el equipo rojiblanco Además el Atlético de Madrid está inmerso en otro proceso sancionador por los mismos hechos La Comisión de Antiviolencia del Consejo Superior de Deportes (CSD) ha propuesto el cierre total del Estadio Metropolitano durante  días y una multa de  euros Una sanción que el club también ha recurrido en este caso ante el Comité de Apelación de nuevo por considerarla como “desproporcionada” La entidad considera que “el comportamiento inaceptable de unos pocos no puede suponer un castigo tan desmedido hacia una gran mayoría que no cometió ninguna falta” El club ha expulsado a cuatro socios implicados en los incidentes violentos durante los cuales los propios jugadores entrenados por Diego Pablo Simeone trataron de hablar con los ultras (acabando por aplaudirles al final del derbi) Recibe las noticias más importantes de Madrid con un boletín escrito para ti todos los viernes en tu correo Apúntate aquí y recíbelas junto a los mejores planes para el fin de semana También puedes seguirnos desde tu red social preferida en Facebook TwitterX o Instagram,17 de octubre de 2024 12:00 h,6
23,Antiviolencia propone clausurar dos semanas el Estadio Metropolitano por los incidentes del Atlético  Real Madrid,La Comisión de Antiviolencia del Consejo Superior de Deportes (CSD) ha propuesto el cierre total del Estadio Metropolitano durante  días y propone una multa de  euros al Atlético de Madrid por los incidentes violentos que tuvieron lugar durante el último derbi madrileño La propuesta de sanción adelantada por la Cadena Ser pide la clausura completa del feudo colchonero debido al lanzamiento de objetos durante el último Atlético  Real Madrid que afectaron especialmente al portero merengue Thibaut Courtois El club rojiblanco ya ha sido multado con  euros por parte de la Liga de Fútbol Profesional que también ha clausurado la grada sur del estadio donde se produjeron los hechos Esta sanción se aplicaría durante los tres próximos partidos en el Metropolitano contra Leganés Las Palmas y Alavés El Atlético de Madrid ha recurrido la sanción y ha expulsado a cuatro socios implicados en los incidentes violentos El club ha recurrido la sanción ante el Comité de Apelación por considerar la sanción como “desproporcionada” “El comportamiento inaceptable de unos pocos no puede suponer un castigo tan desmedido hacia una gran mayoría que no cometió ninguna falta”,15 de octubre de 2024 14:49 h,5
24,Las medidas del Real Madrid no acaban con el ruido ilegal en los conciertos del Bernabéu confirma el Ayuntamiento,La vida sigue igual en el entorno del Estadio Santiago Bernabéu después del verano Es lo que denuncian vecinos de esta zona del distrito de Chamartín que han arremetido en redes sociales contra las emisiones sonoras y las molestias ocasionadas por los conciertos de Romeo Santos el sábado  y el domingo  de septiembre Luego el Ayuntamiento ha confirmado los hechos “Pero qué noche ilegal más estupenda se ha quedado” ironizaba a través de X (antes Twitter) la cuenta más activa en estas quejas RuidoBernabeu Según publica en su perfil a través de una imagen a las  registró  decibelios en su domicilio de la calle Rafael Salgado junto al campo del Real Madrid “Se confirma que la chapuza y la ilegalidad continúan” criticaba más tarde La Ordenanza de Protección Contra la Contaminación Acústica y Térmica sitúa en  decibelios el límite establecido para ese horario (a partir de las  desciende a ) con un margen de otros cinco más antes de que las emisiones sean sancionables Por tanto atendiendo al registro de este vecino el concierto de Romeo Santos habría superado en más de  decibelios el máximo permitido antes de la aplicación de una multa Los incumplimientos sonoros han sido confirmados este lunes por la vicealcaldesa de Madrid Inmaculada Sanz quien admite que las actas que se han levantado durante el fin de semana siguen mostrando que “todavía no están en los límites que deben estar” y que  “todavía hay que seguir mejorando” “Lo que vamos a hacer es seguir exigiendo por supuesto al Real Madrid y a los promotores de esos conciertos que hay que cumplir la normativa de nuestras ordenanzas municipales y por lo tanto que tendrán que tomar todas las medidas para que esa normativa se cumpla de manera tajante” ha asegurado Sanz Después de las constantes quejas de los primeros conciertos el Ayuntamiento que lidera José Luis MartínezAlmeida anunció en junio un refuerzo de los controles y las multas además de limitar a  eventos de este tipo al año en el Bernabéu El propio Almeida restaba poco antes importancia a las quejas “No nos consta que haya habido demasiadas incidencias además de las llamadas de vecinos Se han hecho mediciones y estamos esperando los resultados Los conciertos acaban ahora a las  también se ha mejorado la movilidad así como el servicio de limpieza Tenemos que evaluar estas medidas La prioridad son los vecinos y trabajamos en la solución para ellos” El regidor considera que “los conciertos se están celebrando porque el estadio es apto pero las molestias tienen que minimizarse lo máximo posible” Además de la promesa de una mayor vigilancia por parte del Consistorio el propio Real Madrid emprendió una serie de acciones para tratar de mitigar los efectos de los conciertos cuyos resultados todavía estaban por comprobar Entre estas medidas destacaba la instalación de un “escudo acústico” en la visera de la cubierta (un espacio abierto que atraviesa la zona superior del estadio) Dicho escudo consiste en una lona para mejorar el aislamiento pantallas que forman membranas de protección cierres con material textil de alta atenuación un vidrio laminado termoendurecido y puertas automáticas para formar cámaras de protección en los vomitorios No solo las molestias sonoras han despertado el recelo vecinal sino que las protestas se dirigen también a los residuos y al ambiente en los aledaños del Bernabéu antes durante y después de los conciertos “Nos cuentan que en el estadio cierran los baños una hora antes de terminar los conciertos Total hay zonas verdes (que son de los vecinos) donde desahogarse” denuncia RuidoBernabeu La afectación a la movilidad es otro de sus dardos “Estampas que te dejan helado un botellón en coche aparcado en sitio reservado para quien más lo necesita [personas con discapacidad] ¿Esto no lo vigila el Ayuntamiento de Madrid No es solo el ruido” Algunas personas han optado por mostrar directamente su descontento a través de redes sociales dirigiéndose a responsables políticos como la vicealcaldesa Inmaculada Sanz o la concejala de Chamartín Yolanda Estrada “A la  sigue habiendo ruidos de camiones de limpieza que no deja dormir a nadie Qué decir de la suciedad que genera los macroconciertos y el ruido Solución de verdad a los vecinos ya” reclamaba un usuario a Estrada Unas críticas a las que se ha sumado la oposición municipal La portavoz socialista en el Consistorio Reyes Maroto opinaba este domingo en X que “las medidas del Gobierno de Almeida para controlar las molestias y el ruido en el Bernabéu no convencen ni a los asistentes ni a los vecinos” Y concluye “Cero sorpresas Otra chapuza de Almeida” Recibe las noticias más importantes de Madrid con un boletín escrito para ti todos los viernes en tu correo Apúntate aquí y recíbelas junto a los mejores planes para el fin de semana También puedes seguirnos desde tu red social preferida en Facebook TwitterX o Instagram,Actualizado el 14/10/2024 15:27 h,14
25,Vecinos del Bernabéu denuncian que el Real Madrid tiene la licencia caducada pero el Ayuntamiento lo desmiente,Nueva andanada de los vecinos del estadio del Real Madrid contra la legalidad de los eventos que ha acogido en los últimos meses La Asociación Vecinal de Perjudicados por el Bernabéu ha presentado un recurso de reforma a la querella contra el club de Florentino Pérez que intenta demostrar que no tenía respaldo legal del Ayuntamiento para montar sus actuaciones Los argumentos contenidos en este recurso al que ha tenido acceso este periódico indican que el club merengue ha estado programando eventos deportivos y musicales mientras carecía de licencia de funcionamiento en vigor para ambos Según el escrito el Real Madrid debería haber garantizado al término de las obras que no se producía ninguna afección medioambiental sobre el entorno y las viviendas próximas “Que este extremo no se ha cumplido es evidente” indican los vecinos También afirman que las obras de urbanización no han terminado y que es condición indispensable para conseguir esta licencia Además aseguran que para obtener los permisos de la Comunidad de Madrid a la hora de celebrar los polémicos conciertos se facilitó a los promotores un decreto de concesión de una licencia caducada relativa al año  referida sólo a las graderías del fondo sur del estadio y provocando un error en la Comunidad que tenía que conceder su autorización El Ayuntamiento de Madrid niega tajantemente la falta de licencia “Es falso” aseguran fuentes del área de Urbanismo consultadas por este periódico La licencia actual fue otorgada el pasado  de agosto de  una vez finalizadas las obras de remodelación del estadio La anterior indican las mismas fuentes databa del  de agosto del año  y estaba en vigor en el momento de celebración de los eventos El recurso de la Asociación de Perjudicados por el Bernabéu intenta asimismo ampliar la querella al alcalde de Madrid José Luis MartínezAlmeida y a su concejal de Urbanismo y Medio Ambiente Borja Carabante después de que la jueza rechazara su anterior intento Lo hacen al considerar que deberían haber suspendido los conciertos ante la falta de la licencia pertinente además de los argumentos anteriormente utilizados de superaciones de los niveles de ruido Recibe las noticias más importantes de Madrid con un boletín escrito para ti todos los viernes en tu correo Apúntate aquí y recíbelas junto a los mejores planes para el fin de semana También puedes seguirnos desde tu red social preferida en Facebook TwitterX o Instagram,Actualizado el 11/10/2024 10:10 h,8
