,Titular,Cuerpo,Fecha_Publicada,N_Parrafos
11,La otra cara de las elecciones uruguayas seguridad social y allanamientos nocturnos,Montevideo  oct (EFE) Las elecciones presidenciales y parlamentarias que Uruguay afrontará el próximo  de octubre tendrán una segunda cara que también hará tomar una decisión a la ciudadanía los plebiscitos sobre la seguridad social y los allanamientos nocturnos Pese a que se refieren a temáticas muy diferentes ambas propuestas han dividido las aguas en el sistema político y en el electorado Ahora serán las urnas las que decidirán si se reforma la Constitución Nacional mediante una votación en la que los electores tendrán solamente una papeleta vinculada a cada propuesta que se harán efectivas si una o ambas son introducidas en el sobre por más del  % de los votantes Seguridad social Promovido por la central sindical PITCNT y apoyado por distintas agrupaciones sociales uno de los plebiscitos busca modificar el régimen de seguridad social En agosto de  comenzó a regir en Uruguay la reforma impulsada por el Gobierno de Luis Lacalle Pou que elevó la edad de retiro de los  a los  años y que entre otros cambios permitió que los jubilados pudiesen optar por mantener una actividad laboral Inmediatamente el PITCNT aprobó impulsar un plebiscito con el objetivo de modificar dicha ley y la Constitución Nacional Para ello juntaron firmas y alcanzaron las  cuando necesitaban unas  La reforma promovida propone la equiparación de las jubilaciones y las pensiones al salario mínimo nacional además de la posibilidad de acceder a la jubilación a los  años en lugar de a los  A su vez busca eliminar las administradoras de fondos de ahorro previsional para que el sistema de la Seguridad Social sea gestionado exclusivamente por el Estado A favor y en contra El pasado  de octubre Lacalle Pou dijo que los uruguayos tenían que tomar “una decisión importante” el mismo día de las elecciones e hizo un llamado a la población a no votar a favor del plebiscito Enfatizó que con la reforma se logró un sistema al que definió como “justo y sostenible” al tiempo que remarcó que lo que propone el plebiscito es “peligroso y dañino” “Yo no dudo en decir que hace al sistema insostenible a la mediana o a la larga () Si se aprueba el plebiscito crece exponencialmente esa posibilidad de no ser sostenible el sistema” subrayó Lacalle Pou Asimismo dijo que eso llevará a que se deban aumentar impuestos y recortar prestaciones importantes en el Estado Por su parte los candidatos a la Presidencia por los partidos de la coalición gobernante también se mostraron en contra de lo propuesto en el plebiscito e incluso firmaron un documento en el que se posicionaron en contra de la reforma Mientras tanto el opositor Frente Amplio decidió darle libertad de acción a sus votantes No obstante el candidato a la Presidencia de Uruguay Yamandú Orsi se posicionó en contra Por el lado del PITCNT su presidente Marcelo Abdala defendió la propuesta y dijo que básicamente están tratando de reconstruir derechos que tenían conquistados “Aquí básicamente estamos tratando de reconstruir derechos que teníamos conquistados Derecho a jubilarnos a los  años recuperar el salario mínimo que rebajó la actual administración y llevarlo a nivel del salario mínimo nacional y además establecer una seguridad social sin lucro” detalló Además dijo que la financiación de la reforma se conseguirá mediante los ahorros que el país puede desarrollar al no tener que transferir dinero a las AFAP y con mayor eficiencia fiscal mientras que señaló que se debe estudiar “con mayor rigurosidad las cuantiosas exoneraciones que se le da a la gran riqueza” Allanamientos nocturnos El otro plebiscito que se votará el próximo domingo fue propuesto por parlamentarios de los partidos que conforman la coalición que gobierna Uruguay y pretende que sean habilitados los allanamientos nocturnos El artículo  de la Constitución del país suramericano expresa actualmente “El hogar es un sagrado inviolable De noche nadie podrá entrar en él sin consentimiento de su jefe y de día sólo de orden expresa de Juez competente por escrito y en los casos determinados por la ley” En este caso la coalición de Gobierno apoya la iniciativa mientras que el Frente Amplio emitió una resolución en la que expresó que la propuesta “no es el mejor camino para solucionar los graves problemas de seguridad” y que no la acompañarán,23 de octubre de 2024 17:11 h,22
12,Christine Lagarde asegura sobre las elecciones en EEUU “Hay mucho en juego Debemos estar juntos”,Washington  oct (EFE) La presidenta del Banco Central Europeo (BCE) Christine Lagarde advirtió este miércoles que en las elecciones estadounidenses “hay mucho en juego” y que sea cual sea el resultado ambas potencias deben permanecer juntas “La decisión interna que pertenece sólo al pueblo estadounidense tendrá ramificaciones en todo el mundo de manera muy significativa Así que no es sólo una decisión interna aunque entiendo que la preocupación es mucho más interna” indicó en el centro de pensamiento Atlantic Council de Washington Lagarde se pronunció en un panel organizado en el marco de las reuniones anuales que el Fondo Monetario Internacional (FMI) y el Banco Mundial (BM) celebran esta semana en la capital estadounidense En los comicios del  de noviembre se enfrentarán la vicepresidenta estadounidense y candidata demócrata Kamala Harris y el exmandatario Donald Trump () “Tiene implicaciones enormes fuera de Estados Unidos porque Estados Unidos está liderando de múltiples maneras y tiene que desplegar su liderazgo por el bien común Debemos tener presente eso siempre” dijo la representante europea Lagarde instó a echar la vista atrás y a la historia En concreto a los intercambios postales entre el primer presidente estadounidense George Washington () y el marqués francés de Lafayette asignado para servir en el personal del mandatario “Leyendo las cartas que estos dos hombres se mandaron y el rol que desempeñaron a la hora de forjar la historia que creó este extraordinario país (EEUU) eso debería ser un recordatorio siempre de que en cualquier puesto y situación necesitamos estar juntos” dijo Según Lagarde hay lazos históricos “que se pueden ver en las playas de Normandía o en la costa este de Estados Unidos que no se pueden desperdiciar Estamos juntos y siempre deberíamos estarlo” concluyó,23 de octubre de 2024 17:53 h,8
13,Elecciones en EEUU  Cuándo son candidatos cómo funciona el sistema electoral y todas las claves,Estados Unidos se prepara para volver a las urnas con la misma incertidumbre que hace cuatro años una carrera reñida entre el republicano Donald Trump y la demócrata Kamala Harris que tomó el testigo hace tan solo tres meses después de que Joe Biden renunciara a la candidatura a la presidencia Estas son las claves para no perderse en las próximas elecciones La fecha será el próximo  de noviembre ya que la tradición marca que se celebren el martes posterior al primer lunes de noviembre cada cuatro años Algunos estados abren semanas antes el proceso de voto por correo Como es habitual los medios de comunicación tendrán un papel crucial al ser los que proyectan durante la noche electoral o las horas posteriores quién es el ganador de los comicios ya que las autoridades tardan semanas en oficializar resultados El ganador comenzará un mandato de cuatro años en la Casa Blanca a partir de enero de  El día  de ese mes llamado ‘Inauguration Day’ el presidente electo toma posesión en el Congreso y recorre un breve trayecto hasta a la Casa Blanca Las elecciones presidenciales siempre son el primer martes después del primer lunes de noviembre La razón por la que los estadounidenses lo han establecido así se remonta al siglo XIX y responde a razones prácticas de la época La sociedad de aquel entonces se dedicaba mayoritariamente a la agricultura por lo que el mes de noviembre parecía idóneo ya habría acabado la cosecha pero no haría demasiado frío En lo que respecta a la elección del martes tiene un trasfondo religioso Al calcular que podía ser necesario un día de camino para poder llegar al punto de votación se decidió que el domingo no podía ser un buen día ya que los judíos no acudirían porque estarían celebrando el sabbat De la misma manera tampoco podía ser el lunes porque el domingo era el día de descanso para los cristianos El miércoles era día de mercado así que el martes parecía la opción más acertada El vencedor de las elecciones no es la persona que logra más votos en todo el país Lo que se elige en los comicios son los miembros del Colegio Electoral el organismo que elegirá posteriormente al presidente El Colegio Electoral está formado por  compromisarios que equivalen al número de miembros de la Cámara de Representantes () más el número de senadores () y los tres delegados por Washington DC que no tienen representantes en ninguna de las dos cámaras En total es necesario conseguir el voto de la mitad más uno es decir al menos  para ganar las elecciones Esos  miembros son aportados proporcionalmente por los  estados y el Distrito de Columbia Por ejemplo este año Pensilvania reparte  votos electorales mientras que Arizona da  Texas  Nueva York  y el Distrito de Columbia tres El que gana en cada estado con la excepción de Maine y Nebraska se lleva todos los electores bajo la premisa de the winner take it all O lo que es lo mismo a pesar de que la diferencia sea cuestión de unos pocos votos quien logre imponerse se lleva todos los compromisarios de ese estado Por esta razón las elecciones están realmente en juego en un puñado de estados clave decisivos o ‘bisagra los conocidos como swing states Hay siete estados clave en los que la votación de los ciudadanos decidirá el resultado de las elecciones Arizona Nevada Georgia Carolina del Norte Michigan Wisconsin y Pensilvania De entre los siete swing states Pensilvania es el que este año tiene la llave que abrirá las puertas el Despacho Oval A nivel estatal también hay una serie de ciudades y condados que serán los que decidan quién gana en cada estado Este año Associated Press estima que el condado de Wayne –donde está Detroit (Michigan)– el de Mecklenburg –donde está Charlotte (Carolina del Norte)– y el condado de Fulton –donde está Atlanta (Georgia)– serán algunos de los lugares que habrá que seguir de cerca durante la noche electoral En el caso de Wisconsin y Pensilvania los condados que rodean las ciudades de Milwaukee y Filadelfia también serán cruciales En Arizona igual que pasó en las pasadas elecciones el condado de Maricopa donde está Phoenix será determinante para volver a decidir el color con el que se teñirá el estado Más del % de los votos emitidos en las elecciones del  provenía de este condado En Nevada pasa lo mismo con el condado de Clark donde se encuentra Las Vegas más de dos tercios de los votos de Nevada salieron de este condado En  Biden consiguió derrotar a Trump por unos  votos en Arizona y gracias a ello se llevó los  electores de este estado Desde el  un demócrata no conseguía ganar este estado fronterizo por lo que se convirtió en swing state debido a la probabilidad de decantarse hacia un color u otro En los otros seis estados clave las encuestas también muestran una carrera reñida entre Trump y Harris por lo que ahora se les considera pendulares Hace unos años Ohio era conocido como el swing state por excelencia pero en  dejó de serlo con la victoria del republicano Esta lógica de que el ganador se lo lleva todo y el hecho histórico de que algunos estados rurales (que tienden a votar republicano) tienen mayor representación es algo que juega a favor a Trump Por ejemplo California el estado más poblado y que tiende a votar demócrata tiene  votos electorales para representar a  millones de personas En Wyoming el estado menos poblado y que históricamente ha votado republicano aproximadamente  personas están representadas por tres votos electorales Es decir el voto de una persona en Wyoming cuenta  veces más que el voto de una persona en California Si se hacen las cuentas es fácil ver que  es un número par y podría producirse un empate a  en el Colegio Electoral Aunque es muy improbable que se dé este escenario la legislación ya contempla una solución En este caso la Cámara de Representantes elegiría al presidente entre los tres candidatos más votados Las normas establecen que cada estado emite un voto y este se decide por mayoría entre los congresistas de cada estado Por otro lado el Senado elegiría al vicepresidente entre los dos candidatos más votados –se podría dar la situación de tener un presidente de un partido y un vicepresidente de otro– Esta situación se ha dado dos veces en la historia de Estados Unidos En  Thomas Jefferson y Aaron Burr recibieron el mismo número de votos electorales Entonces la Cámara de Representantes tuvo que votar en  ocasiones seguidas a lo largo de cinco días hasta que Jefferson recibió una mayoría de votos a favor Más allá de Trump y Harris los candidatos de los dos grandes partidos del país en las presidenciales de este  también hay candidatos de terceros partidos que podrían dar alguna sorpresa en los estados clave En cada swing state hay al menos un candidato presidencial independiente o de un tercer partido en la papeleta Ninguno de ellos se acercará ni por asomo a la Casa Blanca pero pueden tener efectos en las trayectorias de Trump y Harris Jill Stein la candidata del Partido Verde y Robert F Kennedy excandidato independiente y que ahora respalda a Trump son de los dos nombres más conocidos Stein goza de popularidad entre los votantes árabes debido a su posición sobre la guerra de Israel en Gaza y a dos semanas de las elecciones una encuesta del New York Times le da alrededor del % de apoyo a nivel nacional Lo mismo pasa con Chase Oliver el candidato del Partido Libertario Su presencia en las papeletas en solo unos pocos estados podría restar suficientes votos a los candidatos de los principales partidos como para inclinar la balanza del Colegio Electoral y de la elección,Actualizado el 23/10/2024 16:46 h,24
14,Elecciones en Uruguay ¿Giro la izquierda o continuidad,Montevideo  oct (EFE) A tan solo cinco días de las elecciones presidenciales y parlamentarias en Uruguay la vuelta de la izquierda al poder o la continuidad de la actual coalición de Gobierno es una incógnita que solo se despejará en las urnas en medio de una campaña “pobre” que hasta el momento no ha logrado convencer al electorado Con Yamandú Orsi liderando todas las encuestas el opositor Frente Amplio buscará volver tras cinco años y luego de haber llevado a cabo la conducción del país sudamericano en el período  Mientras tanto las cuatro fuerzas políticas de la coalición gobernante buscarán unir nuevamente esfuerzos para seguir adelante por otros cinco años Por el momento el oficialista Álvaro Delgado es segundo en todas las encuestas mientras que Andrés Ojeda del Partido Colorado es tercero Para ser electo cualquiera de los candidatos deberá superar el  % de los votos válidos emitidos por los ciudadanos De lo contrario los dos más votados avanzarán a una segunda vuelta el  de noviembre De la “campaña pobre” a los desafíos En diálogo con EFE el politólogo Alfonso Lessa indica que por el momento no da por hecha la victoria de ningún candidato tanto en la primera como en una eventual segunda vuelta Explica que el número de indecisos es alto y “no parece ser totalmente favorable al Frente Amplio” Por otra parte dice que un salto de Ojeda al segundo lugar para avanzar a la siguiente instancia sería “una hazaña política” y repasa que algunas encuestas lo colocan cerca Asimismo apunta que una eventual victoria de la oposición se daría en medio de un escenario de “mucha negociación” ya que en su opinión podría hacerlo sin lograr la mayoría parlamentaria De ser así sería la primera vez que el Frente Amplio gobernaría de esta manera Lessa también habla de la posible aprobación del plebiscito propuesto por la central sindical PITCNT para reformar la seguridad social y lo que esto podría generar a futuro Este también se votará el domingo  de octubre “Si triunfa va a generar problemas para cualquier Gobierno Cuando uno habla con empresarios y demás ves que lo que les preocupa es que se pueda aprobar la reforma de la seguridad social” detalla En ese contexto añade que en el presente ciclo de elecciones el país ha vivido una “campaña pobre” por parte de todos los partidos políticos “No ha habido grandes temas de debate la gente no se ha movilizado ninguno de los candidatos es carismático Ahora están en esta cosa Pero ha sido todo más bien superficial” afirma Optimismo certezas y renovación “Nuestra fuerza política está bien y vamos a ser la fuerza política mayoritaria porque hace tiempo que viene siendo así Eso no es ninguna novedad Hay mucha expectativa de la mayoría parlamentaria de la segunda vuelta Con calma pero con optimismo” dijo días atrás Orsi en una rueda de prensa Allí puntualizó que “es probable” una segunda vuelta ya que en Uruguay “es muy difícil” lograr una victoria en las elecciones de octubre “Evidentemente hay un clima muy diferente y muy auspicioso para nuestro Frente Amplio Hay un entusiasmo militante una alegría y una esperanza en la gente que aparte te lo transmite” concluyó Por su parte Delgado dijo en un acto que su partido representa la esperanza nacional y que es “mucho más que la continuidad del rumbo” “Hoy somos la esperanza nacional de que este rumbo continúe y que Uruguay no retroceda Somos las certezas Este partido nuestro Partido Nacional es el que hoy le da certezas a la gente Certezas a los que nos votan y seguramente también a los que no nos votan” enfatizó En tanto Ojeda indicó en un acto que su fuerza está “donde nadie pensó” que iba a estar y en un lugar “que tiene a muchísima gente enojada y nerviosa” “Hace un buen rato que venimos diciendo que caminamos con dos claves la renovación y la unidad” afirmó el candidato quien añadió que el Partido Colorado está “a un paso” de pelear por la Presidencia Según las últimas encuestas la consultora Factum arrojó que el Frente Amplio alcanzaría el  % de los votos mientras que el  % sería para el Partido Nacional y el  % para el Partido Colorado En tanto la consultora Cifra le dio  % al Frente Amplio  % al Partido Nacional y  % al Partido Colorado Lo arrojado por estas encuestas indica que las elecciones presidenciales del país suramericano se definirán en una segunda vuelta Raúl Martínez,22 de octubre de 2024 18:24 h,26
15,La Universidad de CastillaLa Mancha convoca elecciones al Rectorado para el  de diciembre,El rector de la Universidad de CastillaLa Mancha (UCLM) Julián Garde ha anunciado al Consejo de Gobierno reunido hoy en el campus de Albacete la convocatoria de elecciones a rector o rectora de la institución académica que tendrán lugar el día  de diciembre La secretaria general Isabel Gallego ha informado del calendario electoral que marca para ese día las votaciones en primera vuelta El  de noviembre se publicará el censo definitivo y a partir de ahí del  al  de noviembre se presentarán las candidaturas Ya el  de noviembre se producirá la proclamación definitiva de candidatos y entre el  de noviembre y el  de diciembre tendrá lugar la campaña electoral Las fechas para el voto anticipado se extenderán entre del  al  de noviembre y tras las votaciones el  de diciembre habrá una proclamación provisional de electos El  de diciembre es la fecha elegida para la proclamación definitiva del rector o rectora En caso de que ningún candidato lograra el apoyo proporcional de más de la mitad de los votos se celebraría una segunda vuelta a la que solo podrán concurrir los dos candidatos más apoyados en la primera votación con un calendario que incluiría una nueva campaña electoral del  al  de diciembre y el día  de ese mes las votaciones De ser necesaria esa segunda vuelta para la proclamación definitiva del rector o rectora habría que esperar hasta el  de enero de  Las elecciones al rectorado en la Universidad de CastillaLa Mancha se celebrarán mediante sufragio universal libre secreto y ponderado según lo establecido en los Estatutos de la institución académica La ponderación del voto supone que tras el escrutinio de los votos la Comisión Electoral aplicará los coeficientes que corresponden a cada uno de los sectores en función de su representación en el Claustro Universitario profesores doctores con vinculación permanente a la Universidad  % profesores no pertenecientes al grupo anterior  % estudiantes y personal investigador en formación  % y personal de administración y servicios  % En otro orden de asuntos el Consejo de Gobierno ha aprobado la oferta de empleo público del personal docente e investigador PDI para el año  que asciende a un total de  plazas de las que  corresponden a profesora titular de universidad para el turno libre y otras  plazas de promoción interna para el cuerpo de catedrático de universidad Por su parte se han aprobado  plazas de cuerpos docentes universitarios de las que  corresponden a profesorado titular de universidad por turno libre y  a catedráticoa de universidad por promoción También se ha dado luz verde a la oferta de empleo público para el personal técnico de gestión y administración y servicios PTGAS que asciende a un total de  plazas para promoción interna y un total de  para la convocatoria de acceso libre Asimismo el máximo órgano de representación universitaria ha aprobado la ampliación de la oferta de plazas de Enseñanzas Propias para el presente curso  que asciende a un total de  así como los másteres de Formación Permanente en Gestión Organización y Funcionamiento de las Entidades Locales (MFPGOFEL) de Formación Permanente en Medicina Deportiva (MFPMDP) y de Experto en Empleo con Apoyo como herramienta de inclusión laboral y comunitaria para personas con discapacidad (EXEAHILC) En este ámbito formativo se ha aprobado el Doble Grado en Ingeniería Informática y Administración y Dirección de Empresas y los másteres interuniversitarios en Trabajo Social en el Ámbito Sanitario en Big Data y Computación en la Nube y en Inteligencia Artificial Desde el Vicerrectorado de Estudios Calidad y Acreditación también se ha aprobado la modificación de los planes de estudio del Máster en Innovación y Desarrollo de Alimentos de Calidad y el Máster en Ingeniería Química que se impartirán de forma dual Finalmente los asistentes a la reunión han ratificado el Reglamento de la Escuela Internacional de Doctorado y el convenio entre la Junta de Comunidades de CastillaLa Mancha la UCLM y la Agencia Estatal Consejo Superior de Investigaciones Científicas para el establecimiento de las condiciones de funcionamiento del Instituto de Investigación en Recursos Cinegéticos (IREC),22 de octubre de 2024 21:33 h,14
16,Vox exige la dimisión de Sánchez y una convocatoria de elecciones “inmediata” en todos los Parlamentos autonómicos,MADRID  (EUROPA PRESS) Vox ha registrado este miércoles en todos los Parlamentos autonómicos en los que está representado y en el Congreso una iniciativa en la que exige la dimisión del presidente Pedro Sánchez y todo su Gobierno en bloque y una convocatoria de elecciones “inmediata” alegando que el Gobierno ha cometido “graves actos de corrupción” En el texto los de Santiago Abascal recuerdan que Sánchez llegó a La Moncloa gracias a una moción de censura contra Mariano Rajoy por la corrupción del PP y pone el foco en que seis años después el jefe del Ejecutivo está “rodeado” de “corrupción económica política y moral” enmarcada en “una degradación institucional” “Ya no puede hablarse de casos de corrupción concretos o aislados” indica Vox que habla del caso PSOE y engloba a “familiares y a todo el entorno más cercano” de Sánchez “En la actualidad existen diversas investigaciones abiertas” señalan y pasan proporcionan una lista que incluye el caso Begoña Gómez el caso David Sánchez el caso Koldo y el caso Delcy En este sentido también mencionan la imputación del fiscal general del Estado Álvaro García Ortiz investigado por un presunto delito de revelación de secretos en el marco del caso contra Alberto González Amador el novio de la presidenta de la Comunidad de Madrid Isabel Díaz Ayuso EL GOBIERNO MÁS CORRUPTO DE LA HISTORIA “Todo permite constatar que el Gobierno de Sánchez puede ser considerado como el más corrupto de la historia de España y que efectivamente la corrupción está actuando como un verdadero agente disolvente y nocivo para España” señala Vox Por ello los de Santiago Abascal consideran “imperativo” dar voz a los españoles con la convocatoria de unas elecciones generales después de la dimisión de Sánchez y todo su Ejecutivo Además en la proposición no de ley Vox insta a los Parlamentos autonómicos y al Congreso a “expresar su total repulsa” a la “degradación institucional promovida desde el Gobierno que amenaza con romper la unidad y la igualdad de los españoles y quebrar el Estado de Derecho” Por último reclama “mostrar apoyo a todos los servidores públicos que a pesar de la persecución el señalamiento y las presiones trabajan por esclarecer y perseguir los delitos de este Gobierno corrupto”,23 de octubre de 2024 10:52 h,9
